"ID","Address","City","State","Zip","lat","long","id","input_address","match_indicator","match_type","matched_address","tiger_line_id","tiger_side"
963001,"NOT APPLICABLE","NOT APPLICABLE","FL",32766,NA,NA,1,"NOT APPLICABLE, NOT APPLICABLE, FL, 32766","No_Match",NA,NA,NA,NA
963002,"NOT APPLICABLE","NOT APPLICABLE","FL",32955,NA,NA,2,"NOT APPLICABLE, NOT APPLICABLE, FL, 32955","No_Match",NA,NA,NA,NA
963003,"NOT APPLICABLE","NOT APPLICABLE","FL",33414,NA,NA,3,"NOT APPLICABLE, NOT APPLICABLE, FL, 33414","No_Match",NA,NA,NA,NA
963004,"NOT APPLICABLE","NOT APPLICABLE","FL",34957,NA,NA,4,"NOT APPLICABLE, NOT APPLICABLE, FL, 34957","No_Match",NA,NA,NA,NA
963005,"NOT APPLICABLE","NOT APPLICABLE","FL",99999,NA,NA,5,"NOT APPLICABLE, NOT APPLICABLE, FL, 99999","No_Match",NA,NA,NA,NA
963006,"NOT APPLICABLE","NOT APPLICABLE","KY",99999,NA,NA,6,"NOT APPLICABLE, NOT APPLICABLE, KY, 99999","No_Match",NA,NA,NA,NA
963007,"NOT APPLICABLE","NOT APPLICABLE","MA",0,NA,NA,7,"NOT APPLICABLE, NOT APPLICABLE, MA, 0","No_Match",NA,NA,NA,NA
963008,"NOT APPLICABLE","NOT APPLICABLE","MA",2667,NA,NA,8,"NOT APPLICABLE, NOT APPLICABLE, MA, 2667","No_Match",NA,NA,NA,NA
963009,"NOT APPLICABLE","NOT APPLICABLE","MD",99999,NA,NA,9,"NOT APPLICABLE, NOT APPLICABLE, MD, 99999","No_Match",NA,NA,NA,NA
963010,"NOT APPLICABLE","NOT APPLICABLE","MI",49301,NA,NA,10,"NOT APPLICABLE, NOT APPLICABLE, MI, 49301","No_Match",NA,NA,NA,NA
963011,"NOT APPLICABLE","NOT APPLICABLE",NA,NA,NA,NA,11,"NOT APPLICABLE, NOT APPLICABLE, , ","No_Match",NA,NA,NA,NA
963012,"NOT APPLICABLE","NOT APPLICABLE","NC",0,NA,NA,12,"NOT APPLICABLE, NOT APPLICABLE, NC, 0","No_Match",NA,NA,NA,NA
963013,"NOT APPLICABLE","NOT APPLICABLE","NV",89178,NA,NA,13,"NOT APPLICABLE, NOT APPLICABLE, NV, 89178","No_Match",NA,NA,NA,NA
963014,"NOT APPLICABLE","NOT APPLICABLE","NY",0,NA,NA,14,"NOT APPLICABLE, NOT APPLICABLE, NY, 0","No_Match",NA,NA,NA,NA
963015,"NOT APPLICABLE","NOT APPLICABLE","NY",10022,NA,NA,15,"NOT APPLICABLE, NOT APPLICABLE, NY, 10022","No_Match",NA,NA,NA,NA
963016,"NOT APPLICABLE","NOT APPLICABLE","OK",73120,NA,NA,16,"NOT APPLICABLE, NOT APPLICABLE, OK, 73120","No_Match",NA,NA,NA,NA
963017,"NOT APPLICABLE","NOT APPLICABLE","OR",0,NA,NA,17,"NOT APPLICABLE, NOT APPLICABLE, OR, 0","No_Match",NA,NA,NA,NA
963018,"NOT APPLICABLE","NOT APPLICABLE","OR",97914,NA,NA,18,"NOT APPLICABLE, NOT APPLICABLE, OR, 97914","No_Match",NA,NA,NA,NA
963019,"NOT APPLICABLE","NOT APPLICABLE","PA",0,NA,NA,19,"NOT APPLICABLE, NOT APPLICABLE, PA, 0","No_Match",NA,NA,NA,NA
963020,"NOT APPLICABLE","NOT APPLICABLE","SC",29205,NA,NA,20,"NOT APPLICABLE, NOT APPLICABLE, SC, 29205","No_Match",NA,NA,NA,NA
963021,"NOT APPLICABLE","NOT APPLICABLE","SD",0,NA,NA,21,"NOT APPLICABLE, NOT APPLICABLE, SD, 0","No_Match",NA,NA,NA,NA
963022,"NOT APPLICABLE","NOT APPLICABLE","TX",0,NA,NA,22,"NOT APPLICABLE, NOT APPLICABLE, TX, 0","No_Match",NA,NA,NA,NA
963023,"NOT APPLICABLE","NOT APPLICABLE","TX",77005,NA,NA,23,"NOT APPLICABLE, NOT APPLICABLE, TX, 77005","No_Match",NA,NA,NA,NA
963024,"NOT APPLICABLE","NOT APPLICABLE","TX",99999,NA,NA,24,"NOT APPLICABLE, NOT APPLICABLE, TX, 99999","No_Match",NA,NA,NA,NA
963025,"NOT APPLICABLE","NOT APPLICABLE","VA",0,NA,NA,25,"NOT APPLICABLE, NOT APPLICABLE, VA, 0","No_Match",NA,NA,NA,NA
963026,"NOT APPLICABLE","NOT APPLICABLE","VA",24091,NA,NA,26,"NOT APPLICABLE, NOT APPLICABLE, VA, 24091","No_Match",NA,NA,NA,NA
963027,"NOT AVAILABLE","NOT AVAILABLE","CA",0,NA,NA,27,"NOT AVAILABLE, NOT AVAILABLE, CA, 0","No_Match",NA,NA,NA,NA
963028,"NOT KNOWN","/",NA,NA,NA,NA,28,"NOT KNOWN, /, , ","No_Match",NA,NA,NA,NA
963029,"NOTABLE A DAKAR","DAKAR","UT",90000,NA,NA,29,"NOTABLE A DAKAR, DAKAR, UT, 90000","No_Match",NA,NA,NA,NA
963030,"NOTABLE A KOUSSANAR ESCALE","KOUSSANAR","UT",90000,NA,NA,30,"NOTABLE A KOUSSANAR ESCALE, KOUSSANAR, UT, 90000","No_Match",NA,NA,NA,NA
963031,"NOTLEY STREET","PASADENA","MD",21122,NA,NA,31,"NOTLEY STREET, PASADENA, MD, 21122","No_Match",NA,NA,NA,NA
963032,"NOTRE DAME COLLEGE - 4545 COLLEGE R","SOUTH EUCLID","OH",44121,41.505612012,-81.515290818,32,"NOTRE DAME COLLEGE - 4545 COLLEGE R, SOUTH EUCLID, OH, 44121","Match","Exact","4545 COLLEGE RD, SOUTH EUCLID, OH, 44121",61125832,"L"
963033,"NOUTOUA ZIETOUA","WINDSOR MILL","MD",21244,NA,NA,33,"NOUTOUA ZIETOUA, WINDSOR MILL, MD, 21244","No_Match",NA,NA,NA,NA
963034,"NOWELA PLACE","KAILUA","HI",96734,NA,NA,34,"NOWELA PLACE, KAILUA, HI, 96734","No_Match",NA,NA,NA,NA
963035,"NOWHERE","NONE","AZ",85018,NA,NA,35,"NOWHERE, NONE, AZ, 85018","No_Match",NA,NA,NA,NA
963036,"NP 101 169-A","SANTA FE","NM",87506,NA,NA,36,"NP 101 169-A, SANTA FE, NM, 87506","No_Match",NA,NA,NA,NA
963037,"NP 118 NUMBER 377","SANTA FE","NM",87506,NA,NA,37,"NP 118 NUMBER 377, SANTA FE, NM, 87506","No_Match",NA,NA,NA,NA
963038,"NP43 LAKE CHEROKEE","LONGVIEW","TX",75603,NA,NA,38,"NP43 LAKE CHEROKEE, LONGVIEW, TX, 75603","Tie",NA,NA,NA,NA
963039,"NREM 339 SCIENCE II HALL","AMES","IA",50011,NA,NA,39,"NREM 339 SCIENCE II HALL, AMES, IA, 50011","No_Match",NA,NA,NA,NA
963040,"NTA ROAD GARDNERSVILLE","MONROVIA",NA,NA,NA,NA,40,"NTA ROAD GARDNERSVILLE, MONROVIA, , ","No_Match",NA,NA,NA,NA
963041,"NUKK-FREEMAN 26 MAIN ST STE 202","CHATHAM","NJ",7928,NA,NA,41,"NUKK-FREEMAN 26 MAIN ST STE 202, CHATHAM, NJ, 7928","No_Match",NA,NA,NA,NA
963042,"NUMBER 3 111 BENT STREET","TAOS","NM",87571,36.408356031,-105.573050924,42,"NUMBER 3 111 BENT STREET, TAOS, NM, 87571","Match","Exact","111 BENT ST, TAOS, NM, 87571",159934354,"R"
963043,"NUMBER 5 SUMMERWIND PLACE","ROSWELL","NM",88201,NA,NA,43,"NUMBER 5 SUMMERWIND PLACE, ROSWELL, NM, 88201","No_Match",NA,NA,NA,NA
963044,"NUMBER 7  12TH AVENUE","NESQUEHONING","PA",18240,NA,NA,44,"NUMBER 7  12TH AVENUE, NESQUEHONING, PA, 18240","No_Match",NA,NA,NA,NA
963045,"NUMERO GROUP","CHICAGO","IL",60623,NA,NA,45,"NUMERO GROUP, CHICAGO, IL, 60623","No_Match",NA,NA,NA,NA
963046,"NURSERY SCHOOL 208 4TH ST","WINTERS","CA",95694,38.5190087330001,-121.974298455,46,"NURSERY SCHOOL 208 4TH ST, WINTERS, CA, 95694","Match","Exact","208 4TH ST, WINTERS, CA, 95694",67695028,"L"
963047,"NUUULI","PAGO PAGO","AS",96799,NA,NA,47,"NUUULI, PAGO PAGO, AS, 96799","No_Match",NA,NA,NA,NA
963048,"NVRC 3040 WILLIAMS DR SUITE 200","FAIRFAX","VA",22031,NA,NA,48,"NVRC 3040 WILLIAMS DR SUITE 200, FAIRFAX, VA, 22031","No_Match",NA,NA,NA,NA
963049,"NW 112 AVE APT 116","DORAL","FL",33178,NA,NA,49,"NW 112 AVE APT 116, DORAL, FL, 33178","No_Match",NA,NA,NA,NA
963050,"NW 113TH AVENUE","PARKLAND","FL",33076,NA,NA,50,"NW 113TH AVENUE, PARKLAND, FL, 33076","No_Match",NA,NA,NA,NA
963051,"NW 2096 JAKES LITTLE FIREWEED LANE","HOMER","AK",99603,NA,NA,51,"NW 2096 JAKES LITTLE FIREWEED LANE, HOMER, AK, 99603","No_Match",NA,NA,NA,NA
963052,"NW 36TH PLACE","CORAL SPRINGS","FL",33065,NA,NA,52,"NW 36TH PLACE, CORAL SPRINGS, FL, 33065","No_Match",NA,NA,NA,NA
963053,"NW COUNTY ROAD 12","BRISTOL","FL",32321,NA,NA,53,"NW COUNTY ROAD 12, BRISTOL, FL, 32321","No_Match",NA,NA,NA,NA
963054,"NWACC  ONE COLLEGE DRIVE","BENTONVILLE","AR",72712,NA,NA,54,"NWACC  ONE COLLEGE DRIVE, BENTONVILLE, AR, 72712","No_Match",NA,NA,NA,NA
963055,"NWMS 6889 N OAK TRAFFICWAY STE400","GLADSTONE","MO",64119,NA,NA,55,"NWMS 6889 N OAK TRAFFICWAY STE400, GLADSTONE, MO, 64119","No_Match",NA,NA,NA,NA
963056,"NWMSU  108 OWENS LIBRARY","MARYVILLE","MO",64468,NA,NA,56,"NWMSU  108 OWENS LIBRARY, MARYVILLE, MO, 64468","No_Match",NA,NA,NA,NA
963057,"NWU LAW 375 EAST CHICAGO AVE","CHICAGO","IL",60611,41.8967891570001,-87.619988865,57,"NWU LAW 375 EAST CHICAGO AVE, CHICAGO, IL, 60611","Match","Exact","375 E CHICAGO AVE, CHICAGO, IL, 60611",111890231,"R"
963058,"NY","BRONX","NY",10462,NA,NA,58,"NY, BRONX, NY, 10462","No_Match",NA,NA,NA,NA
963059,"NY","BROOKLYN","NY",11219,NA,NA,59,"NY, BROOKLYN, NY, 11219","No_Match",NA,NA,NA,NA
963060,"NY","CORTLANDT MANOR","NY",10567,NA,NA,60,"NY, CORTLANDT MANOR, NY, 10567","No_Match",NA,NA,NA,NA
963061,"NY","FOREST HILLS","NY",11375,NA,NA,61,"NY, FOREST HILLS, NY, 11375","No_Match",NA,NA,NA,NA
963062,"NYARUGUSU","KIGOMA","WI",53208,NA,NA,62,"NYARUGUSU, KIGOMA, WI, 53208","No_Match",NA,NA,NA,NA
963063,"NYIT NORTH HOUSE NORTHERN BLVD","OLD WESTBURY","NY",11568,NA,NA,63,"NYIT NORTH HOUSE NORTHERN BLVD, OLD WESTBURY, NY, 11568","No_Match",NA,NA,NA,NA
963064,"NYS ROUTE 3","HENDERSON","NY",13650,NA,NA,64,"NYS ROUTE 3, HENDERSON, NY, 13650","No_Match",NA,NA,NA,NA
963065,"NYU 530 1ST AVE 6TH FL","NEW YORK","NY",10016,NA,NA,65,"NYU 530 1ST AVE 6TH FL, NEW YORK, NY, 10016","No_Match",NA,NA,NA,NA
963066,"O BOX 161697","BIG SKY","MT",59716,NA,NA,66,"O BOX 161697, BIG SKY, MT, 59716","No_Match",NA,NA,NA,NA
963067,"O O BOX 85","SPURGER","TX",77660,NA,NA,67,"O O BOX 85, SPURGER, TX, 77660","No_Match",NA,NA,NA,NA
963068,"O","0","IL",0,NA,NA,68,"O, 0, IL, 0","No_Match",NA,NA,NA,NA
963069,"O","O","PA",19001,NA,NA,69,"O, O, PA, 19001","No_Match",NA,NA,NA,NA
963070,"O143 GROUSE CT","AVON","CO",81620,NA,NA,70,"O143 GROUSE CT, AVON, CO, 81620","No_Match",NA,NA,NA,NA
963071,"O3 GRANDVIEW DR","SOUTH BURLINGTON","VT",5403,44.4509071370001,-73.1757245379999,71,"O3 GRANDVIEW DR, SOUTH BURLINGTON, VT, 5403","Match","Exact","O3 GRANDVIEW DR, S BURLINGTON, VT, 05403",135855792,"R"
963072,"OA BUTTONWOOD LANE","PEABODY","MA",1960,NA,NA,72,"OA BUTTONWOOD LANE, PEABODY, MA, 1960","No_Match",NA,NA,NA,NA
963073,"OAK HILL ROAD","FRANKLIN","PA",16353,NA,NA,73,"OAK HILL ROAD, FRANKLIN, PA, 16353","No_Match",NA,NA,NA,NA
963074,"OAK HILL","PITTSBURGH","PA",15213,NA,NA,74,"OAK HILL, PITTSBURGH, PA, 15213","No_Match",NA,NA,NA,NA
963075,"OAK ROAD","NORRIS","TN",37828,NA,NA,75,"OAK ROAD, NORRIS, TN, 37828","No_Match",NA,NA,NA,NA
963076,"OAK RUN LANE","RALEIGH","NC",27606,NA,NA,76,"OAK RUN LANE, RALEIGH, NC, 27606","No_Match",NA,NA,NA,NA
963077,"OAK STREET","CARMI","IL",62821,NA,NA,77,"OAK STREET, CARMI, IL, 62821","No_Match",NA,NA,NA,NA
963078,"OAK STREET","DANVILLE","IA",52623,NA,NA,78,"OAK STREET, DANVILLE, IA, 52623","No_Match",NA,NA,NA,NA
963079,"OAK STREET","GREENVILLE","MO",63944,NA,NA,79,"OAK STREET, GREENVILLE, MO, 63944","No_Match",NA,NA,NA,NA
963080,"OAK STREET","MEADVILLE","PA",16345,NA,NA,80,"OAK STREET, MEADVILLE, PA, 16345","No_Match",NA,NA,NA,NA
963081,"OAKLAND UNIVERSITY WRITING CEN","ROCHESTER","MI",48309,NA,NA,81,"OAKLAND UNIVERSITY WRITING CEN, ROCHESTER, MI, 48309","No_Match",NA,NA,NA,NA
963082,"OAKVIEW DRIVE","NASHVILLE","TN",37207,NA,NA,82,"OAKVIEW DRIVE, NASHVILLE, TN, 37207","No_Match",NA,NA,NA,NA
963083,"OBANION RD","YUBA CITY","CA",95991,NA,NA,83,"OBANION RD, YUBA CITY, CA, 95991","No_Match",NA,NA,NA,NA
963084,"OBISPADO 253 BO MIRADERO","MAYAGUEZ","PR",682,NA,NA,84,"OBISPADO 253 BO MIRADERO, MAYAGUEZ, PR, 682","No_Match",NA,NA,NA,NA
963085,"OCAMPO 106 FRACC-RIO BRAVO 2","RIO BRAVO, MX",NA,NA,NA,NA,85,"OCAMPO 106 FRACC-RIO BRAVO 2, RIO BRAVO, MX, , ","No_Match",NA,NA,NA,NA
963086,"OCEAN DRIVE EAST","STAMFORD","CT",6902,NA,NA,86,"OCEAN DRIVE EAST, STAMFORD, CT, 6902","No_Match",NA,NA,NA,NA
963087,"OCH STREET","ROCHESTER","PA",15074,NA,NA,87,"OCH STREET, ROCHESTER, PA, 15074","No_Match",NA,NA,NA,NA
963088,"OCPJ  16 S  CAMPUS","OXFORD","OH",45056,NA,NA,88,"OCPJ  16 S  CAMPUS, OXFORD, OH, 45056","No_Match",NA,NA,NA,NA
963089,"OCPJ  16 S CAMPUS","OXFORD","OH",45056,NA,NA,89,"OCPJ  16 S CAMPUS, OXFORD, OH, 45056","No_Match",NA,NA,NA,NA
963090,"OCPJ 16 S CAMPUS","OXFORD","OH",45056,NA,NA,90,"OCPJ 16 S CAMPUS, OXFORD, OH, 45056","No_Match",NA,NA,NA,NA
963091,"OCTOBER COVE","SHELLEY","ID",83274,NA,NA,91,"OCTOBER COVE, SHELLEY, ID, 83274","No_Match",NA,NA,NA,NA
963092,"ODAY 35 W 35TH ST","NEW YORK","NY",10001,NA,NA,92,"ODAY 35 W 35TH ST, NEW YORK, NY, 10001","No_Match",NA,NA,NA,NA
963093,"ODDSTAD","PACIFICA","CA",94044,NA,NA,93,"ODDSTAD, PACIFICA, CA, 94044","No_Match",NA,NA,NA,NA
963094,"ODPG CHATELAIN","GONAIVES",NA,NA,NA,NA,94,"ODPG CHATELAIN, GONAIVES, , ","No_Match",NA,NA,NA,NA
963095,"OEHC BLDG 5 APT 55","ST THOMAS","VI",802,NA,NA,95,"OEHC BLDG 5 APT 55, ST THOMAS, VI, 802","No_Match",NA,NA,NA,NA
963096,"OF 8087 WORTHY DR","WESTMINSTER","CA",92683,NA,NA,96,"OF 8087 WORTHY DR, WESTMINSTER, CA, 92683","No_Match",NA,NA,NA,NA
963097,"OFFICE 149 BLDG T 155 S RAISINVILLE","MONROE","MI",48161,41.9353886280001,-83.461835617,97,"OFFICE 149 BLDG T 155 S RAISINVILLE, MONROE, MI, 48161","Match","Non_Exact","155 S RAISINVILLE RD, MONROE, MI, 48161",40478970,"R"
963098,"OFS - 875 N MICHIGAN AVE STE 2700","CHICAGO","IL",60611,NA,NA,98,"OFS - 875 N MICHIGAN AVE STE 2700, CHICAGO, IL, 60611","No_Match",NA,NA,NA,NA
963099,"OGUN STATE","NIGERIA",NA,NA,NA,NA,99,"OGUN STATE, NIGERIA, , ","No_Match",NA,NA,NA,NA
963100,"OH","CLEVELAND","OH",44108,NA,NA,100,"OH, CLEVELAND, OH, 44108","No_Match",NA,NA,NA,NA
963101,"OH","NEW ALBANY","OH",43054,NA,NA,101,"OH, NEW ALBANY, OH, 43054","No_Match",NA,NA,NA,NA
963102,"OHIO UNIV 57 OXBOW TRAIL","ATHENS","OH",45701,39.3261566190001,-82.104055495,102,"OHIO UNIV 57 OXBOW TRAIL, ATHENS, OH, 45701","Match","Exact","57 OXBOW TRL, ATHENS, OH, 45701",652273619,"R"
963103,"OK BOX 3161","SAN RAFAEL","CA",94912,NA,NA,103,"OK BOX 3161, SAN RAFAEL, CA, 94912","No_Match",NA,NA,NA,NA
963104,"OLD BEAUE COURT","CHURCHVILLE","MD",21028,NA,NA,104,"OLD BEAUE COURT, CHURCHVILLE, MD, 21028","No_Match",NA,NA,NA,NA
963105,"OLD BOONTON ROAD","DENVILLE","NJ",7834,NA,NA,105,"OLD BOONTON ROAD, DENVILLE, NJ, 7834","No_Match",NA,NA,NA,NA
963106,"OLD CALHOUN ROAD","ROME","GA",30161,NA,NA,106,"OLD CALHOUN ROAD, ROME, GA, 30161","No_Match",NA,NA,NA,NA
963107,"OLD COLUMBUS ROAD","TUSKEGEE","AL",36083,NA,NA,107,"OLD COLUMBUS ROAD, TUSKEGEE, AL, 36083","No_Match",NA,NA,NA,NA
963108,"OLD COUNTRY ROAD","WAITSFIELD","VT",5673,NA,NA,108,"OLD COUNTRY ROAD, WAITSFIELD, VT, 5673","No_Match",NA,NA,NA,NA
963109,"OLD DOMINION ST","RICHMOND","VA",23224,NA,NA,109,"OLD DOMINION ST, RICHMOND, VA, 23224","No_Match",NA,NA,NA,NA
963110,"OLD FARM ROAD","SPRINGFIELD","MA",1119,NA,NA,110,"OLD FARM ROAD, SPRINGFIELD, MA, 1119","No_Match",NA,NA,NA,NA
963111,"OLD FERRY ROAD","GWYNN","VA",23066,NA,NA,111,"OLD FERRY ROAD, GWYNN, VA, 23066","No_Match",NA,NA,NA,NA
963112,"OLD FORGE ROAD","SMITHSBURG","MD",21783,NA,NA,112,"OLD FORGE ROAD, SMITHSBURG, MD, 21783","No_Match",NA,NA,NA,NA
963113,"OLD HOSPITAL TRAILER CT NW 25","PINE RIDGE","SD",57770,NA,NA,113,"OLD HOSPITAL TRAILER CT NW 25, PINE RIDGE, SD, 57770","No_Match",NA,NA,NA,NA
963114,"OLD LEE ROAD","NEWFIELDS","NH",3856,NA,NA,114,"OLD LEE ROAD, NEWFIELDS, NH, 3856","No_Match",NA,NA,NA,NA
963115,"OLD NEW LIBERTY ROAD","OWENTON","KY",40359,NA,NA,115,"OLD NEW LIBERTY ROAD, OWENTON, KY, 40359","No_Match",NA,NA,NA,NA
963116,"OLD NEWPORT ROAD","MARLOW","NH",3456,NA,NA,116,"OLD NEWPORT ROAD, MARLOW, NH, 3456","No_Match",NA,NA,NA,NA
963117,"OLD ORCHARD RD","SHERBORN","MA",1770,NA,NA,117,"OLD ORCHARD RD, SHERBORN, MA, 1770","No_Match",NA,NA,NA,NA
963118,"OLD POST RD","MARLBORO","NY",12542,NA,NA,118,"OLD POST RD, MARLBORO, NY, 12542","No_Match",NA,NA,NA,NA
963119,"OLD RED STAR DR","BROOKHAVEN","MS",39601,NA,NA,119,"OLD RED STAR DR, BROOKHAVEN, MS, 39601","No_Match",NA,NA,NA,NA
963120,"OLD ROUTE 8 PO BOX 16","JAMAICA","VT",5343,NA,NA,120,"OLD ROUTE 8 PO BOX 16, JAMAICA, VT, 5343","No_Match",NA,NA,NA,NA
963121,"OLD RT 35","CHILLICOTHE","OH",45601,NA,NA,121,"OLD RT 35, CHILLICOTHE, OH, 45601","No_Match",NA,NA,NA,NA
963122,"OLD RTE 213","HIGH FALLS","NY",12440,NA,NA,122,"OLD RTE 213, HIGH FALLS, NY, 12440","No_Match",NA,NA,NA,NA
963123,"OLD SANDFORT ROAD","SEALE","AL",36875,NA,NA,123,"OLD SANDFORT ROAD, SEALE, AL, 36875","No_Match",NA,NA,NA,NA
963124,"OLD SANTA SUZANA PASS RD","CHATSWORTH","CA",91311,NA,NA,124,"OLD SANTA SUZANA PASS RD, CHATSWORTH, CA, 91311","No_Match",NA,NA,NA,NA
963125,"OLD ST RD 67","PARAGON","IN",46166,NA,NA,125,"OLD ST RD 67, PARAGON, IN, 46166","No_Match",NA,NA,NA,NA
963126,"OLD STATE ROAD","OWINGSVILLE","KY",40360,NA,NA,126,"OLD STATE ROAD, OWINGSVILLE, KY, 40360","No_Match",NA,NA,NA,NA
963127,"OLD STERLING HWY","ANCHOR POINT","AK",99556,NA,NA,127,"OLD STERLING HWY, ANCHOR POINT, AK, 99556","No_Match",NA,NA,NA,NA
963128,"OLD SUMMER CAMP RD","WARREN","VT",5674,NA,NA,128,"OLD SUMMER CAMP RD, WARREN, VT, 5674","No_Match",NA,NA,NA,NA
963129,"OLIPMIA ST NUM 19 BO SALTILLO","ADJUNTAS","PR",601,NA,NA,129,"OLIPMIA ST NUM 19 BO SALTILLO, ADJUNTAS, PR, 601","No_Match",NA,NA,NA,NA
963130,"OLIVER LOOP RD","ROXBORO","NC",27574,NA,NA,130,"OLIVER LOOP RD, ROXBORO, NC, 27574","No_Match",NA,NA,NA,NA
963131,"OLIVER ROAD APT 201","RALEIGH","NC",27614,NA,NA,131,"OLIVER ROAD APT 201, RALEIGH, NC, 27614","No_Match",NA,NA,NA,NA
963132,"OLIVETT RD","LUSBY","MD",20657,NA,NA,132,"OLIVETT RD, LUSBY, MD, 20657","No_Match",NA,NA,NA,NA
963133,"OMOHUNDRO STREET","NORFOLK","VA",23504,NA,NA,133,"OMOHUNDRO STREET, NORFOLK, VA, 23504","No_Match",NA,NA,NA,NA
963134,"ON476 BAKER DRIVE","GENEVA","IL",60134,NA,NA,134,"ON476 BAKER DRIVE, GENEVA, IL, 60134","No_Match",NA,NA,NA,NA
963135,"ON645 BRANDON BLVD","WINFIELD","IL",60190,NA,NA,135,"ON645 BRANDON BLVD, WINFIELD, IL, 60190","No_Match",NA,NA,NA,NA
963136,"ONE 46TH STREET","WEEHAWKEN","NJ",7208,NA,NA,136,"ONE 46TH STREET, WEEHAWKEN, NJ, 7208","No_Match",NA,NA,NA,NA
963137,"ONE 7TH ST UNIT 1703","AUGUSTA","GA",30901,NA,NA,137,"ONE 7TH ST UNIT 1703, AUGUSTA, GA, 30901","No_Match",NA,NA,NA,NA
963138,"ONE 7TH STREET 1101","AUGUSTA","GA",30901,NA,NA,138,"ONE 7TH STREET 1101, AUGUSTA, GA, 30901","No_Match",NA,NA,NA,NA
963139,"ONE ADAMS BLVD","FARMINGDALE","NY",11735,NA,NA,139,"ONE ADAMS BLVD, FARMINGDALE, NY, 11735","No_Match",NA,NA,NA,NA
963140,"ONE AIR TERMINAL PARKWAY","MELBOURNE","FL",32901,NA,NA,140,"ONE AIR TERMINAL PARKWAY, MELBOURNE, FL, 32901","No_Match",NA,NA,NA,NA
963141,"ONE ALEXANDER STREET","YONKERS","NY",10701,NA,NA,141,"ONE ALEXANDER STREET, YONKERS, NY, 10701","No_Match",NA,NA,NA,NA
963142,"ONE ALUMNI DRIVE","HAMPTON","NH",3842,NA,NA,142,"ONE ALUMNI DRIVE, HAMPTON, NH, 3842","No_Match",NA,NA,NA,NA
963143,"ONE AMC WAY  11500 ASH STREET","LEAWOOD","KS",66211,38.9195359660001,-94.646943441,143,"ONE AMC WAY  11500 ASH STREET, LEAWOOD, KS, 66211","Match","Exact","11500 ASH ST, LEAWOOD, KS, 66211",650173821,"R"
963144,"ONE AMERICAN SQUARE SUITE 2500","INDIANAPOLIS","IN",46282,NA,NA,144,"ONE AMERICAN SQUARE SUITE 2500, INDIANAPOLIS, IN, 46282","No_Match",NA,NA,NA,NA
963145,"ONE AMERICAN SQUARE","INDIANAPOLIS","IN",46282,NA,NA,145,"ONE AMERICAN SQUARE, INDIANAPOLIS, IN, 46282","No_Match",NA,NA,NA,NA
963146,"ONE ARON CT","BETHPAGE","NY",11714,NA,NA,146,"ONE ARON CT, BETHPAGE, NY, 11714","No_Match",NA,NA,NA,NA
963147,"ONE ASSELBORN WAY","GLENWOOD","IL",60425,NA,NA,147,"ONE ASSELBORN WAY, GLENWOOD, IL, 60425","No_Match",NA,NA,NA,NA
963148,"ONE AVE OF THE PALMS","SAN FRANCISCO","CA",94130,NA,NA,148,"ONE AVE OF THE PALMS, SAN FRANCISCO, CA, 94130","No_Match",NA,NA,NA,NA
963149,"ONE AVERY STREET","BOSTON","MA",2111,NA,NA,149,"ONE AVERY STREET, BOSTON, MA, 2111","No_Match",NA,NA,NA,NA
963150,"ONE BATTERY PARK PLAZA","NEW YORK","NY",10004,NA,NA,150,"ONE BATTERY PARK PLAZA, NEW YORK, NY, 10004","No_Match",NA,NA,NA,NA
963151,"ONE BAY CLUB 11F","BAYSIDE","NY",11360,NA,NA,151,"ONE BAY CLUB 11F, BAYSIDE, NY, 11360","No_Match",NA,NA,NA,NA
963152,"ONE BEACH DRIVE SE","ST PETERSBURG","FL",33701,NA,NA,152,"ONE BEACH DRIVE SE, ST PETERSBURG, FL, 33701","No_Match",NA,NA,NA,NA
963153,"ONE BEAR PLACE - 97313","WACO","TX",76798,NA,NA,153,"ONE BEAR PLACE - 97313, WACO, TX, 76798","No_Match",NA,NA,NA,NA
963154,"ONE BEAR PLACE 82113","WACO","TX",76798,NA,NA,154,"ONE BEAR PLACE 82113, WACO, TX, 76798","No_Match",NA,NA,NA,NA
963155,"ONE BEAR PLACE 83752","WACO","TX",76798,NA,NA,155,"ONE BEAR PLACE 83752, WACO, TX, 76798","No_Match",NA,NA,NA,NA
963156,"ONE BEAR PLACE 97356","WACO","TX",76798,NA,NA,156,"ONE BEAR PLACE 97356, WACO, TX, 76798","No_Match",NA,NA,NA,NA
963157,"ONE BEAR PLACE PO BOX 60761","WACO","TX",76798,NA,NA,157,"ONE BEAR PLACE PO BOX 60761, WACO, TX, 76798","No_Match",NA,NA,NA,NA
963158,"ONE BEAR PLACE PO BOX 82119","WACO","TX",76798,NA,NA,158,"ONE BEAR PLACE PO BOX 82119, WACO, TX, 76798","No_Match",NA,NA,NA,NA
963159,"ONE BEAR PLACE UNIT 97222","WACO","TX",76798,NA,NA,159,"ONE BEAR PLACE UNIT 97222, WACO, TX, 76798","No_Match",NA,NA,NA,NA
963160,"ONE BEAR PLACE- 98007","WACO","TX",76798,NA,NA,160,"ONE BEAR PLACE- 98007, WACO, TX, 76798","No_Match",NA,NA,NA,NA
963161,"ONE BEEKMAN PLACE","NEW YORK","NY",10022,NA,NA,161,"ONE BEEKMAN PLACE, NEW YORK, NY, 10022","No_Match",NA,NA,NA,NA
963162,"ONE BELMONT AVE SUITE 315","BALA CYNWYD","PA",19004,NA,NA,162,"ONE BELMONT AVE SUITE 315, BALA CYNWYD, PA, 19004","No_Match",NA,NA,NA,NA
963163,"ONE BERGEN COUNTY PLAZA 4TH FLOOR","HACKENSACK","NJ",7601,NA,NA,163,"ONE BERGEN COUNTY PLAZA 4TH FLOOR, HACKENSACK, NJ, 7601","No_Match",NA,NA,NA,NA
963164,"ONE BERNARD BARUCH WAY","NEW YORK","NY",10010,NA,NA,164,"ONE BERNARD BARUCH WAY, NEW YORK, NY, 10010","No_Match",NA,NA,NA,NA
963165,"ONE BERNARD BARUCH WAY","SOUTH PALM BEACH","NY",10010,NA,NA,165,"ONE BERNARD BARUCH WAY, SOUTH PALM BEACH, NY, 10010","No_Match",NA,NA,NA,NA
963166,"ONE BETHANY PIKE","WHEELING","WV",26003,NA,NA,166,"ONE BETHANY PIKE, WHEELING, WV, 26003","No_Match",NA,NA,NA,NA
963167,"ONE BLUE HILL PLAZA","PEARL RIVER","NY",10965,NA,NA,167,"ONE BLUE HILL PLAZA, PEARL RIVER, NY, 10965","No_Match",NA,NA,NA,NA
963168,"ONE BRENTWOOD ROAD","WINDHAM","NH",3087,NA,NA,168,"ONE BRENTWOOD ROAD, WINDHAM, NH, 3087","No_Match",NA,NA,NA,NA
963169,"ONE BROADWAY SUITE B210","DENVER","CO",80203,NA,NA,169,"ONE BROADWAY SUITE B210, DENVER, CO, 80203","No_Match",NA,NA,NA,NA
963170,"ONE BROADWAY","ELMWOOD PARK","NJ",7407,NA,NA,170,"ONE BROADWAY, ELMWOOD PARK, NJ, 7407","No_Match",NA,NA,NA,NA
963171,"ONE BROOKFIELD ROAD","LITITZ","PA",17543,NA,NA,171,"ONE BROOKFIELD ROAD, LITITZ, PA, 17543","No_Match",NA,NA,NA,NA
963172,"ONE BROOKINGS DR","SAINT LOUIS","MO",63130,NA,NA,172,"ONE BROOKINGS DR, SAINT LOUIS, MO, 63130","No_Match",NA,NA,NA,NA
963173,"ONE BROOKINGS DRIVE CAMPUS BOX 1122","ST LOUIS","MO",63130,NA,NA,173,"ONE BROOKINGS DRIVE CAMPUS BOX 1122, ST LOUIS, MO, 63130","No_Match",NA,NA,NA,NA
963174,"ONE BROOKINGS DRIVE","SAINT LOUIS","MO",63130,NA,NA,174,"ONE BROOKINGS DRIVE, SAINT LOUIS, MO, 63130","No_Match",NA,NA,NA,NA
963175,"ONE BRYANT PARK","NEW YORK","NY",10036,NA,NA,175,"ONE BRYANT PARK, NEW YORK, NY, 10036","No_Match",NA,NA,NA,NA
963176,"ONE BUSH STREET","SAN FRANCISCO","CA",94104,NA,NA,176,"ONE BUSH STREET, SAN FRANCISCO, CA, 94104","No_Match",NA,NA,NA,NA
963177,"ONE CAMPUS MARTIUS SUITE 200","DETROIT","MI",48226,NA,NA,177,"ONE CAMPUS MARTIUS SUITE 200, DETROIT, MI, 48226","No_Match",NA,NA,NA,NA
963178,"ONE CAPITAL MALL SUITE 670","SACRAMENTO","CA",95814,NA,NA,178,"ONE CAPITAL MALL SUITE 670, SACRAMENTO, CA, 95814","No_Match",NA,NA,NA,NA
963179,"ONE CAPITOL HEIGHTS BLVD","CAPITOL HEIGHTS","MD",20743,NA,NA,179,"ONE CAPITOL HEIGHTS BLVD, CAPITOL HEIGHTS, MD, 20743","No_Match",NA,NA,NA,NA
963180,"ONE CAPITOL HILL GROUND LEVEL","PROVIDENCE","RI",2908,NA,NA,180,"ONE CAPITOL HILL GROUND LEVEL, PROVIDENCE, RI, 2908","No_Match",NA,NA,NA,NA
963181,"ONE CAPITOL MALL SUITE 640","SACRAMENTO","CA",95814,NA,NA,181,"ONE CAPITOL MALL SUITE 640, SACRAMENTO, CA, 95814","No_Match",NA,NA,NA,NA
963182,"ONE CAPO DRIVE","MARLBORO","NJ",7746,NA,NA,182,"ONE CAPO DRIVE, MARLBORO, NJ, 7746","No_Match",NA,NA,NA,NA
963183,"ONE CARBON CTR SUITE 200","CHESAPEAKE","WV",25815,NA,NA,183,"ONE CARBON CTR SUITE 200, CHESAPEAKE, WV, 25815","No_Match",NA,NA,NA,NA
963184,"ONE CARDINAL WAY","VINEYARD HAVEN","MA",2568,NA,NA,184,"ONE CARDINAL WAY, VINEYARD HAVEN, MA, 2568","No_Match",NA,NA,NA,NA
963185,"ONE CASCADE PLAZA SUITE 825","AKRON","OH",44308,NA,NA,185,"ONE CASCADE PLAZA SUITE 825, AKRON, OH, 44308","No_Match",NA,NA,NA,NA
963186,"ONE CENTER COURT SUITE 200","PORTLAND","OR",97227,NA,NA,186,"ONE CENTER COURT SUITE 200, PORTLAND, OR, 97227","No_Match",NA,NA,NA,NA
963187,"ONE CHASE CORPORATE CENTER STE 400","BIRMINGHAM","AL",35244,NA,NA,187,"ONE CHASE CORPORATE CENTER STE 400, BIRMINGHAM, AL, 35244","No_Match",NA,NA,NA,NA
963188,"ONE CHELSEA AVENUE 209","LONG BRANCH","NJ",7740,NA,NA,188,"ONE CHELSEA AVENUE 209, LONG BRANCH, NJ, 7740","No_Match",NA,NA,NA,NA
963189,"ONE CHILDRENS PLAZA","DAYTON","OH",45404,NA,NA,189,"ONE CHILDRENS PLAZA, DAYTON, OH, 45404","No_Match",NA,NA,NA,NA
963190,"ONE CHILTON DRIVE","CHESTERFIELD","NJ",8515,NA,NA,190,"ONE CHILTON DRIVE, CHESTERFIELD, NJ, 8515","No_Match",NA,NA,NA,NA
963191,"ONE CIRCULAR AVE","HAMDEN","CT",6514,NA,NA,191,"ONE CIRCULAR AVE, HAMDEN, CT, 6514","No_Match",NA,NA,NA,NA
963192,"ONE CITIZENS PLAZA 8TH FL","PROVIDENCE","RI",2903,NA,NA,192,"ONE CITIZENS PLAZA 8TH FL, PROVIDENCE, RI, 2903","No_Match",NA,NA,NA,NA
963193,"ONE CITY PLAZA","YUMA","AZ",85364,NA,NA,193,"ONE CITY PLAZA, YUMA, AZ, 85364","No_Match",NA,NA,NA,NA
963194,"ONE CLUB PKWY","NASHVILLE","TN",37221,NA,NA,194,"ONE CLUB PKWY, NASHVILLE, TN, 37221","No_Match",NA,NA,NA,NA
963195,"ONE COCACOLA PLAZA","ATLANTA","GA",30313,NA,NA,195,"ONE COCACOLA PLAZA, ATLANTA, GA, 30313","No_Match",NA,NA,NA,NA
963196,"ONE COLLEGE AVENUE - SUITE 3002","MECHANICSBURG",NA,NA,NA,NA,196,"ONE COLLEGE AVENUE - SUITE 3002, MECHANICSBURG, , ","No_Match",NA,NA,NA,NA
963197,"ONE COLLEGE AVENUE - SUITE 3002","MECHANICSBURG","PA",17055,NA,NA,197,"ONE COLLEGE AVENUE - SUITE 3002, MECHANICSBURG, PA, 17055","No_Match",NA,NA,NA,NA
963198,"ONE COLLEGE PARK","DECATUR","IL",62521,NA,NA,198,"ONE COLLEGE PARK, DECATUR, IL, 62521","No_Match",NA,NA,NA,NA
963199,"ONE COLLEY AVE NO 141","NORFOLK","VA",23510,NA,NA,199,"ONE COLLEY AVE NO 141, NORFOLK, VA, 23510","No_Match",NA,NA,NA,NA
963200,"ONE COLUMBUS CENTER","VIRGINIA BEACH","VA",23464,NA,NA,200,"ONE COLUMBUS CENTER, VIRGINIA BEACH, VA, 23464","No_Match",NA,NA,NA,NA
963201,"ONE COLUMBUS STREET SUITE 695","VIRGINIA BEACH","VA",23462,NA,NA,201,"ONE COLUMBUS STREET SUITE 695, VIRGINIA BEACH, VA, 23462","No_Match",NA,NA,NA,NA
963202,"ONE COMMERCE PLAZA","ALBANY","NY",12260,NA,NA,202,"ONE COMMERCE PLAZA, ALBANY, NY, 12260","No_Match",NA,NA,NA,NA
963203,"ONE COMMERCE SQUARE","GADSDEN","AL",35901,NA,NA,203,"ONE COMMERCE SQUARE, GADSDEN, AL, 35901","No_Match",NA,NA,NA,NA
