"ID","Address","City","State","Zip","lat","long","id","input_address","match_indicator","match_type","matched_address","tiger_line_id","tiger_side"
963204,"ONE CONSTITUTION PLAZA","HARTFORD","CT",6103,NA,NA,204,"ONE CONSTITUTION PLAZA, HARTFORD, CT, 6103","No_Match",NA,NA,NA,NA
963205,"ONE COOL BLOW STREET SUITE 322","CHARLESTON","SC",29403,NA,NA,205,"ONE COOL BLOW STREET SUITE 322, CHARLESTON, SC, 29403","No_Match",NA,NA,NA,NA
963206,"ONE CORAOPOLIS RD - UNIT 103","CORAOPOLIS","PA",15108,NA,NA,206,"ONE CORAOPOLIS RD - UNIT 103, CORAOPOLIS, PA, 15108","No_Match",NA,NA,NA,NA
963207,"ONE CORAOPOLIS RD - UNIT 200","CORAOPOLIS","PA",15108,NA,NA,207,"ONE CORAOPOLIS RD - UNIT 200, CORAOPOLIS, PA, 15108","No_Match",NA,NA,NA,NA
963208,"ONE CORAOPOLIS RD - UNIT 205","CORAOPOLIS","PA",15108,NA,NA,208,"ONE CORAOPOLIS RD - UNIT 205, CORAOPOLIS, PA, 15108","No_Match",NA,NA,NA,NA
963209,"ONE CORAOPOLIS RD - UNIT 303","CORAOPOLIS","PA",15108,NA,NA,209,"ONE CORAOPOLIS RD - UNIT 303, CORAOPOLIS, PA, 15108","No_Match",NA,NA,NA,NA
963210,"ONE CORAOPOLIS RD - UNIT 305","CORAOPOLIS","PA",15108,NA,NA,210,"ONE CORAOPOLIS RD - UNIT 305, CORAOPOLIS, PA, 15108","No_Match",NA,NA,NA,NA
963211,"ONE CORPORATE CENTER","RYE","NY",10580,NA,NA,211,"ONE CORPORATE CENTER, RYE, NY, 10580","No_Match",NA,NA,NA,NA
963212,"ONE CORWIN COURT","NEWBURGH","NY",12550,NA,NA,212,"ONE CORWIN COURT, NEWBURGH, NY, 12550","No_Match",NA,NA,NA,NA
963213,"ONE COUNTY COMPLEX ROAD","BEDFORD","IN",47421,NA,NA,213,"ONE COUNTY COMPLEX ROAD, BEDFORD, IN, 47421","No_Match",NA,NA,NA,NA
963214,"ONE DAHLGREN LANE","HILTON HEAD ISLAND","SC",29928,NA,NA,214,"ONE DAHLGREN LANE, HILTON HEAD ISLAND, SC, 29928","No_Match",NA,NA,NA,NA
963215,"ONE DANIEL BURNHAM CT SUITE 240","SAN FRANCISCO","CA",94109,NA,NA,215,"ONE DANIEL BURNHAM CT SUITE 240, SAN FRANCISCO, CA, 94109","No_Match",NA,NA,NA,NA
963216,"ONE DEARBORN SQUARE STE 400","KANKAKEE","IL",60901,NA,NA,216,"ONE DEARBORN SQUARE STE 400, KANKAKEE, IL, 60901","No_Match",NA,NA,NA,NA
963217,"ONE DEPOT PLAZA","TARRYTOWN","NY",10591,NA,NA,217,"ONE DEPOT PLAZA, TARRYTOWN, NY, 10591","No_Match",NA,NA,NA,NA
963218,"ONE DORRANCE STREET","PROVIDENCE","RI",2903,NA,NA,218,"ONE DORRANCE STREET, PROVIDENCE, RI, 2903","No_Match",NA,NA,NA,NA
963219,"ONE EAST BROWARD BLVD SUITE 1200","FORT LAUDERDALE","FL",33301,NA,NA,219,"ONE EAST BROWARD BLVD SUITE 1200, FORT LAUDERDALE, FL, 33301","No_Match",NA,NA,NA,NA
963220,"ONE EAST DELAWARE APT 24B","CHICAGO","IL",60611,NA,NA,220,"ONE EAST DELAWARE APT 24B, CHICAGO, IL, 60611","No_Match",NA,NA,NA,NA
963221,"ONE EAST FOURTH STREET SUITE 1400","CINCINNATI","OH",45202,NA,NA,221,"ONE EAST FOURTH STREET SUITE 1400, CINCINNATI, OH, 45202","No_Match",NA,NA,NA,NA
963222,"ONE EAST MAIN STREET SUITE 500","MADISON","WI",53703,NA,NA,222,"ONE EAST MAIN STREET SUITE 500, MADISON, WI, 53703","No_Match",NA,NA,NA,NA
963223,"ONE EAST MELLEN STREET","HAMPTON","VA",23663,NA,NA,223,"ONE EAST MELLEN STREET, HAMPTON, VA, 23663","No_Match",NA,NA,NA,NA
963224,"ONE EAST SCHILLER 15C","CHICAGO","IL",60610,NA,NA,224,"ONE EAST SCHILLER 15C, CHICAGO, IL, 60610","No_Match",NA,NA,NA,NA
963225,"ONE EASY STREET","HICKORY CREEK","TX",75065,NA,NA,225,"ONE EASY STREET, HICKORY CREEK, TX, 75065","No_Match",NA,NA,NA,NA
963226,"ONE EDGEMOOR ROAD","PITTSBURGH","PA",15238,NA,NA,226,"ONE EDGEMOOR ROAD, PITTSBURGH, PA, 15238","No_Match",NA,NA,NA,NA
963227,"ONE EDGEWOOD DRIVE","KEWANEE","IL",61443,NA,NA,227,"ONE EDGEWOOD DRIVE, KEWANEE, IL, 61443","No_Match",NA,NA,NA,NA
963228,"ONE ELKINS COVE B - 4","OCEANA","WV",24870,NA,NA,228,"ONE ELKINS COVE B - 4, OCEANA, WV, 24870","No_Match",NA,NA,NA,NA
963229,"ONE ENERGY PLAZA","DETROIT","MI",48226,NA,NA,229,"ONE ENERGY PLAZA, DETROIT, MI, 48226","No_Match",NA,NA,NA,NA
963230,"ONE ESTATE HOPE","CHRISTIANSTED","VI",820,NA,NA,230,"ONE ESTATE HOPE, CHRISTIANSTED, VI, 820","No_Match",NA,NA,NA,NA
963231,"ONE FBI PLAZA","BUFFALO","NY",14202,NA,NA,231,"ONE FBI PLAZA, BUFFALO, NY, 14202","No_Match",NA,NA,NA,NA
963232,"ONE FED PLACE 1819 5TH AVE N","BIRMINGHAM","AL",35203,33.5168013380001,-86.8108846969999,232,"ONE FED PLACE 1819 5TH AVE N, BIRMINGHAM, AL, 35203","Match","Exact","1819 5TH AVE N, BIRMINGHAM, AL, 35203",81575704,"R"
963233,"ONE FEDERAL PLAZA 1819 5TH AVE N","BIRMINGHAM","AL",35203,33.5168013380001,-86.8108846969999,233,"ONE FEDERAL PLAZA 1819 5TH AVE N, BIRMINGHAM, AL, 35203","Match","Exact","1819 5TH AVE N, BIRMINGHAM, AL, 35203",81575704,"R"
963234,"ONE FINANCIAL CENTER","BOSTON","MA",2111,NA,NA,234,"ONE FINANCIAL CENTER, BOSTON, MA, 2111","No_Match",NA,NA,NA,NA
963235,"ONE FINANCIAL PLAZA 7TH FLOOR","FORT LAUDERDALE","FL",33394,NA,NA,235,"ONE FINANCIAL PLAZA 7TH FLOOR, FORT LAUDERDALE, FL, 33394","No_Match",NA,NA,NA,NA
963236,"ONE FINE ARTS DRIVE FOREST PARK","ST LOUIS","MO",63110,NA,NA,236,"ONE FINE ARTS DRIVE FOREST PARK, ST LOUIS, MO, 63110","No_Match",NA,NA,NA,NA
963237,"ONE FORESTRY DR","SYRACUSE","NY",13126,NA,NA,237,"ONE FORESTRY DR, SYRACUSE, NY, 13126","No_Match",NA,NA,NA,NA
963238,"ONE FORESTWOOD DRIVE SUITE 201","PITTSBURGH","PA",15237,NA,NA,238,"ONE FORESTWOOD DRIVE SUITE 201, PITTSBURGH, PA, 15237","No_Match",NA,NA,NA,NA
963239,"ONE FOX RUN","PRINCETON","WV",24739,NA,NA,239,"ONE FOX RUN, PRINCETON, WV, 24739","No_Match",NA,NA,NA,NA
963240,"ONE FRANKLIN SQUARE STE 211","GENEVA","NY",14456,NA,NA,240,"ONE FRANKLIN SQUARE STE 211, GENEVA, NY, 14456","No_Match",NA,NA,NA,NA
963241,"ONE GATEWAY CENTER 26TH FLOOR","NEWARK","NJ",7102,NA,NA,241,"ONE GATEWAY CENTER 26TH FLOOR, NEWARK, NJ, 7102","No_Match",NA,NA,NA,NA
963242,"ONE GATEWAY CENTER","NEWARK","NJ",7102,NA,NA,242,"ONE GATEWAY CENTER, NEWARK, NJ, 7102","No_Match",NA,NA,NA,NA
963243,"ONE GAYLORD DRIVE","NASHVILLE","TN",37214,NA,NA,243,"ONE GAYLORD DRIVE, NASHVILLE, TN, 37214","No_Match",NA,NA,NA,NA
963244,"ONE GORDON MILLS WAY","ST JOHNSBRY","VT",5819,NA,NA,244,"ONE GORDON MILLS WAY, ST JOHNSBRY, VT, 5819","No_Match",NA,NA,NA,NA
963245,"ONE GORDON MILLS WAY","ST JOHNSBURY","VT",5819,NA,NA,245,"ONE GORDON MILLS WAY, ST JOHNSBURY, VT, 5819","No_Match",NA,NA,NA,NA
963246,"ONE GRAND ARMY PLAZA 12C","BROOKLYN","NY",11238,NA,NA,246,"ONE GRAND ARMY PLAZA 12C, BROOKLYN, NY, 11238","No_Match",NA,NA,NA,NA
963247,"ONE GREEN GLADE COURT","PHOENIX","MD",21131,NA,NA,247,"ONE GREEN GLADE COURT, PHOENIX, MD, 21131","No_Match",NA,NA,NA,NA
963248,"ONE GREEN STREET","STAMFORD","CT",6902,NA,NA,248,"ONE GREEN STREET, STAMFORD, CT, 6902","No_Match",NA,NA,NA,NA
963249,"ONE GUSTAVE LEVY PLACE BOX 1163","NEW YORK","NY",10029,NA,NA,249,"ONE GUSTAVE LEVY PLACE BOX 1163, NEW YORK, NY, 10029","No_Match",NA,NA,NA,NA
963250,"ONE GUSTAVE LEVY PLACE DEPT OF EM","NEW YORK","NY",10029,NA,NA,250,"ONE GUSTAVE LEVY PLACE DEPT OF EM, NEW YORK, NY, 10029","No_Match",NA,NA,NA,NA
963251,"ONE HAMILTON COUNTY SQUARE STE 345","NOBLESVILLE","IN",46060,NA,NA,251,"ONE HAMILTON COUNTY SQUARE STE 345, NOBLESVILLE, IN, 46060","No_Match",NA,NA,NA,NA
963252,"ONE HAMILTON COUNTY SQUARE STE345","NOBLESVILLE","IN",46060,NA,NA,252,"ONE HAMILTON COUNTY SQUARE STE345, NOBLESVILLE, IN, 46060","No_Match",NA,NA,NA,NA
963253,"ONE HANSON PLACE APT 24D","BROOKLYN","NY",11243,NA,NA,253,"ONE HANSON PLACE APT 24D, BROOKLYN, NY, 11243","No_Match",NA,NA,NA,NA
963254,"ONE HARBOR CENTER SUITE 280","SUISUN CITY","CA",94585,NA,NA,254,"ONE HARBOR CENTER SUITE 280, SUISUN CITY, CA, 94585","No_Match",NA,NA,NA,NA
963255,"ONE HARTWICK DRIVE","ONEONTA","NY",13820,NA,NA,255,"ONE HARTWICK DRIVE, ONEONTA, NY, 13820","No_Match",NA,NA,NA,NA
963256,"ONE HAVEN PLAZA 17C","NEW YORK","NY",10009,NA,NA,256,"ONE HAVEN PLAZA 17C, NEW YORK, NY, 10009","No_Match",NA,NA,NA,NA
963257,"ONE HICKORY LANE","LAPLATA","MD",20646,NA,NA,257,"ONE HICKORY LANE, LAPLATA, MD, 20646","No_Match",NA,NA,NA,NA
963258,"ONE HOAG DRIVE POB 6100","NEWPORT BEACH","CA",92658,NA,NA,258,"ONE HOAG DRIVE POB 6100, NEWPORT BEACH, CA, 92658","No_Match",NA,NA,NA,NA
963259,"ONE HOLLOW LANE SUITE 301","LAKE SUCCESS","NY",11042,NA,NA,259,"ONE HOLLOW LANE SUITE 301, LAKE SUCCESS, NY, 11042","No_Match",NA,NA,NA,NA
963260,"ONE HOSPITAL DR- CE740 CSE BLDG","COLUMBIA","MO",65212,NA,NA,260,"ONE HOSPITAL DR- CE740 CSE BLDG, COLUMBIA, MO, 65212","No_Match",NA,NA,NA,NA
963261,"ONE HUNTINGTON QUADRANGLE STE 4C10","MELVILLE","NY",11747,NA,NA,261,"ONE HUNTINGTON QUADRANGLE STE 4C10, MELVILLE, NY, 11747","No_Match",NA,NA,NA,NA
963262,"ONE HUNTINGTON RD- STE 106","ATHENS","GA",30606,NA,NA,262,"ONE HUNTINGTON RD- STE 106, ATHENS, GA, 30606","No_Match",NA,NA,NA,NA
963263,"ONE INDEPENDENT DRIVE SUITE 1200","JACKSONVILLE","FL",32202,NA,NA,263,"ONE INDEPENDENT DRIVE SUITE 1200, JACKSONVILLE, FL, 32202","No_Match",NA,NA,NA,NA
963264,"ONE INDIANA SQUARE SUITE 3500","INDIANAPOLIS","IN",46204,NA,NA,264,"ONE INDIANA SQUARE SUITE 3500, INDIANAPOLIS, IN, 46204","No_Match",NA,NA,NA,NA
963265,"ONE INTERNATIONAL PLACE","BOSTON","MA",2110,NA,NA,265,"ONE INTERNATIONAL PLACE, BOSTON, MA, 2110","No_Match",NA,NA,NA,NA
963266,"ONE IRVING PLACE G-17F","NEW YORK","NY",10003,NA,NA,266,"ONE IRVING PLACE G-17F, NEW YORK, NY, 10003","No_Match",NA,NA,NA,NA
963267,"ONE JETS DRIVE","FLORHAM PARK","NJ",7932,NA,NA,267,"ONE JETS DRIVE, FLORHAM PARK, NJ, 7932","No_Match",NA,NA,NA,NA
963268,"ONE KELLOGG HILL ROAD","WESTON","CT",6883,NA,NA,268,"ONE KELLOGG HILL ROAD, WESTON, CT, 6883","No_Match",NA,NA,NA,NA
963269,"ONE LAFAYETTE PLAISANCE ST","DETROIT","MI",48207,NA,NA,269,"ONE LAFAYETTE PLAISANCE ST, DETROIT, MI, 48207","No_Match",NA,NA,NA,NA
963270,"ONE LAKE STREET BLDG D","NEW BRITIAN","CT",6052,NA,NA,270,"ONE LAKE STREET BLDG D, NEW BRITIAN, CT, 6052","No_Match",NA,NA,NA,NA
963271,"ONE LARCH CIRCLE","MADISON","WI",53705,NA,NA,271,"ONE LARCH CIRCLE, MADISON, WI, 53705","No_Match",NA,NA,NA,NA
963272,"ONE LEADERSHIP WAY","GREENSBOROUGH","NC",27410,NA,NA,272,"ONE LEADERSHIP WAY, GREENSBOROUGH, NC, 27410","No_Match",NA,NA,NA,NA
963273,"ONE LETTERMAN DR BLDG C SUITE 300","SAN FRANCISCO","CA",94301,NA,NA,273,"ONE LETTERMAN DR BLDG C SUITE 300, SAN FRANCISCO, CA, 94301","No_Match",NA,NA,NA,NA
963274,"ONE LEVERICH PLACE","HUNTINGTON","NY",11743,NA,NA,274,"ONE LEVERICH PLACE, HUNTINGTON, NY, 11743","No_Match",NA,NA,NA,NA
963275,"ONE LINCOLN CENTER 18TH FLOOOR","SYRACUSE","NY",13202,NA,NA,275,"ONE LINCOLN CENTER 18TH FLOOOR, SYRACUSE, NY, 13202","No_Match",NA,NA,NA,NA
963276,"ONE LINCOLN CENTER 18TH FLOOR","SYRACUSE","NY",13202,NA,NA,276,"ONE LINCOLN CENTER 18TH FLOOR, SYRACUSE, NY, 13202","No_Match",NA,NA,NA,NA
963277,"ONE LOWENSTEIN DRIVE","ROSELAND","NJ",7068,NA,NA,277,"ONE LOWENSTEIN DRIVE, ROSELAND, NJ, 7068","No_Match",NA,NA,NA,NA
963278,"ONE MAIN STREET SUITE 201","EVANSVILLE","IN",47708,NA,NA,278,"ONE MAIN STREET SUITE 201, EVANSVILLE, IN, 47708","No_Match",NA,NA,NA,NA
963279,"ONE MAIN STREET","CANTON","NY",13617,NA,NA,279,"ONE MAIN STREET, CANTON, NY, 13617","No_Match",NA,NA,NA,NA
963280,"ONE MAIN STREET","HOUSTON","TX",77002,NA,NA,280,"ONE MAIN STREET, HOUSTON, TX, 77002","No_Match",NA,NA,NA,NA
963281,"ONE MAJOR LANE","NEW HYDE PARK","NY",11040,NA,NA,281,"ONE MAJOR LANE, NEW HYDE PARK, NY, 11040","No_Match",NA,NA,NA,NA
963282,"ONE MARINE VIEW PLAZA - 12A","HOBOKEN","NJ",7030,NA,NA,282,"ONE MARINE VIEW PLAZA - 12A, HOBOKEN, NJ, 7030","No_Match",NA,NA,NA,NA
963283,"ONE MASONIC DRIVE","ELIZABETHTOWN","PA",17022,NA,NA,283,"ONE MASONIC DRIVE, ELIZABETHTOWN, PA, 17022","No_Match",NA,NA,NA,NA
963284,"ONE MCKINSTRY PLACE","HUDSON","NY",12534,NA,NA,284,"ONE MCKINSTRY PLACE, HUDSON, NY, 12534","No_Match",NA,NA,NA,NA
963285,"ONE MEADOW WAY","LAWRENCE","NY",11559,NA,NA,285,"ONE MEADOW WAY, LAWRENCE, NY, 11559","No_Match",NA,NA,NA,NA
963286,"ONE MEDICAL CENTER DR","LEBANON","NH",3756,NA,NA,286,"ONE MEDICAL CENTER DR, LEBANON, NH, 3756","No_Match",NA,NA,NA,NA
963287,"ONE MEMORIAL DRIVE","LODI","NJ",7644,NA,NA,287,"ONE MEMORIAL DRIVE, LODI, NJ, 7644","No_Match",NA,NA,NA,NA
963288,"ONE MENDON ROAD SUITE 310","CUMBERLAND","RI",2864,NA,NA,288,"ONE MENDON ROAD SUITE 310, CUMBERLAND, RI, 2864","No_Match",NA,NA,NA,NA
963289,"ONE MICHIGAN AVENUE SUITE 900","LANSING","MI",48933,NA,NA,289,"ONE MICHIGAN AVENUE SUITE 900, LANSING, MI, 48933","No_Match",NA,NA,NA,NA
963290,"ONE MICROSOFT WAY","REDMOND","WA",98052,NA,NA,290,"ONE MICROSOFT WAY, REDMOND, WA, 98052","No_Match",NA,NA,NA,NA
963291,"ONE MIDAMERICA PLAZA STE 125","OAKBROOK TERRACE","IL",60181,NA,NA,291,"ONE MIDAMERICA PLAZA STE 125, OAKBROOK TERRACE, IL, 60181","No_Match",NA,NA,NA,NA
963292,"ONE MILL WHARF S26","SCITUATE","MA",2066,NA,NA,292,"ONE MILL WHARF S26, SCITUATE, MA, 2066","No_Match",NA,NA,NA,NA
963293,"ONE MOHEGAN SUN BLVD","UNCASVILLE","CT",6382,NA,NA,293,"ONE MOHEGAN SUN BLVD, UNCASVILLE, CT, 6382","No_Match",NA,NA,NA,NA
963294,"ONE MOHEGAN SUN BOULEVARD","UNCASVILLE","CT",6382,NA,NA,294,"ONE MOHEGAN SUN BOULEVARD, UNCASVILLE, CT, 6382","No_Match",NA,NA,NA,NA
963295,"ONE MONARCH PLACE 2220","SPRINGFIELD","MA",1144,NA,NA,295,"ONE MONARCH PLACE 2220, SPRINGFIELD, MA, 1144","No_Match",NA,NA,NA,NA
963296,"ONE MOTT LANE","HOUSTON","TX",77024,NA,NA,296,"ONE MOTT LANE, HOUSTON, TX, 77024","No_Match",NA,NA,NA,NA
963297,"ONE MTN BROOK WAY 34  PO BOX 87","WATERVILLE VALLEY","NH",3215,NA,NA,297,"ONE MTN BROOK WAY 34  PO BOX 87, WATERVILLE VALLEY, NH, 3215","No_Match",NA,NA,NA,NA
963298,"ONE MUNICIPAL DR","DERRY","NH",3038,NA,NA,298,"ONE MUNICIPAL DR, DERRY, NH, 3038","No_Match",NA,NA,NA,NA
963299,"ONE MUNICIPAL PLAZA","ASBURY PARK","NJ",7712,NA,NA,299,"ONE MUNICIPAL PLAZA, ASBURY PARK, NJ, 7712","No_Match",NA,NA,NA,NA
963300,"ONE N LASALLE STREET SUITE 2205","CHICAGO","IL",60602,NA,NA,300,"ONE N LASALLE STREET SUITE 2205, CHICAGO, IL, 60602","No_Match",NA,NA,NA,NA
963301,"ONE NATIONAL LIFE DRIVE","MONTPELIER","VT",5633,NA,NA,301,"ONE NATIONAL LIFE DRIVE, MONTPELIER, VT, 5633","No_Match",NA,NA,NA,NA
963302,"ONE NATURAL RESOURCES WAY","SPRINGFIELD","IL",61702,NA,NA,302,"ONE NATURAL RESOURCES WAY, SPRINGFIELD, IL, 61702","No_Match",NA,NA,NA,NA
963303,"ONE NATURAL RESOURCES WAY","SPRINGFIELD","IL",62702,NA,NA,303,"ONE NATURAL RESOURCES WAY, SPRINGFIELD, IL, 62702","No_Match",NA,NA,NA,NA
963304,"ONE NEUMANN DR NIFS","ASTON","PA",19014,NA,NA,304,"ONE NEUMANN DR NIFS, ASTON, PA, 19014","No_Match",NA,NA,NA,NA
963305,"ONE NEUMANN DR RAB 326","ASTON","PA",19014,NA,NA,305,"ONE NEUMANN DR RAB 326, ASTON, PA, 19014","No_Match",NA,NA,NA,NA
963306,"ONE NFA PARK","AMHERST","NY",14228,NA,NA,306,"ONE NFA PARK, AMHERST, NY, 14228","No_Match",NA,NA,NA,NA
963307,"ONE NORMAN J FIELD WAY","TINTON FALLS","NJ",7724,NA,NA,307,"ONE NORMAN J FIELD WAY, TINTON FALLS, NJ, 7724","No_Match",NA,NA,NA,NA
963308,"ONE NORTH BRENTWOOD BLVD SUITE 600","ST. LOUIS","MO",63105,NA,NA,308,"ONE NORTH BRENTWOOD BLVD SUITE 600, ST. LOUIS, MO, 63105","No_Match",NA,NA,NA,NA
963309,"ONE NORTH CAPITAL SUITE 1050","INDIANAPOLIS","IN",46204,NA,NA,309,"ONE NORTH CAPITAL SUITE 1050, INDIANAPOLIS, IN, 46204","No_Match",NA,NA,NA,NA
963310,"ONE NORTH MAIN ST","BERKLEY","MA",2779,NA,NA,310,"ONE NORTH MAIN ST, BERKLEY, MA, 2779","No_Match",NA,NA,NA,NA
963311,"ONE OAK PLACE","OXFORD","MS",38655,NA,NA,311,"ONE OAK PLACE, OXFORD, MS, 38655","No_Match",NA,NA,NA,NA
963312,"ONE OLD FERRY RD","BRISTOL","RI",2809,NA,NA,312,"ONE OLD FERRY RD, BRISTOL, RI, 2809","No_Match",NA,NA,NA,NA
963313,"ONE OLD FERRY ROAD","BRISTOL","MA",2809,NA,NA,313,"ONE OLD FERRY ROAD, BRISTOL, MA, 2809","No_Match",NA,NA,NA,NA
963314,"ONE PANTHER WAY","NORTON","OH",44203,NA,NA,314,"ONE PANTHER WAY, NORTON, OH, 44203","No_Match",NA,NA,NA,NA
963315,"ONE PARK LANE UNIT 3B","MOUNT VERNON","NY",10552,NA,NA,315,"ONE PARK LANE UNIT 3B, MOUNT VERNON, NY, 10552","No_Match",NA,NA,NA,NA
963316,"ONE PARK PLAZA SUITE 600","IRVINE","CA",92614,NA,NA,316,"ONE PARK PLAZA SUITE 600, IRVINE, CA, 92614","No_Match",NA,NA,NA,NA
963317,"ONE PARK ROW 5TH FLOOR","PROVIDENCE","RI",2903,NA,NA,317,"ONE PARK ROW 5TH FLOOR, PROVIDENCE, RI, 2903","No_Match",NA,NA,NA,NA
963318,"ONE PARKER PLACE STE 610","JANESVILLE","WI",53545,NA,NA,318,"ONE PARKER PLACE STE 610, JANESVILLE, WI, 53545","No_Match",NA,NA,NA,NA
963319,"ONE PAUL BROWN DR SE","MASSILLON","OH",44646,NA,NA,319,"ONE PAUL BROWN DR SE, MASSILLON, OH, 44646","No_Match",NA,NA,NA,NA
963320,"ONE PEAT HOLE LANE","BELLPORT","NY",11713,NA,NA,320,"ONE PEAT HOLE LANE, BELLPORT, NY, 11713","No_Match",NA,NA,NA,NA
963321,"ONE PERFORMANCE DR","ANGLETON","TX",77515,NA,NA,321,"ONE PERFORMANCE DR, ANGLETON, TX, 77515","No_Match",NA,NA,NA,NA
963322,"ONE PERKINS SQUARE","AKRON","OH",44308,NA,NA,322,"ONE PERKINS SQUARE, AKRON, OH, 44308","No_Match",NA,NA,NA,NA
963323,"ONE PETOSKEY STREET","PETOSKEY","MI",49770,NA,NA,323,"ONE PETOSKEY STREET, PETOSKEY, MI, 49770","No_Match",NA,NA,NA,NA
963324,"ONE PINE BLUFF","DERRY","NH",3038,NA,NA,324,"ONE PINE BLUFF, DERRY, NH, 3038","No_Match",NA,NA,NA,NA
963325,"ONE PLAZA UN HEADQUARTERS","NEW YORK","NY",11204,NA,NA,325,"ONE PLAZA UN HEADQUARTERS, NEW YORK, NY, 11204","No_Match",NA,NA,NA,NA
963326,"ONE POLICE PLAZA 106 HUDSON STREET","HOBOKEN","NJ",7030,40.7372918680001,-74.0297947139999,326,"ONE POLICE PLAZA 106 HUDSON STREET, HOBOKEN, NJ, 7030","Match","Exact","106 HUDSON ST, HOBOKEN, NJ, 07030",646609511,"L"
963327,"ONE PRESERVE PARKWAY","ROCKVILLE","MD",20852,NA,NA,327,"ONE PRESERVE PARKWAY, ROCKVILLE, MD, 20852","No_Match",NA,NA,NA,NA
963328,"ONE PUBLIC SQUARE","WILLOUGHBY","OH",44094,NA,NA,328,"ONE PUBLIC SQUARE, WILLOUGHBY, OH, 44094","No_Match",NA,NA,NA,NA
963329,"ONE RAPP ROAD","ALBANY","NY",12203,NA,NA,329,"ONE RAPP ROAD, ALBANY, NY, 12203","No_Match",NA,NA,NA,NA
963330,"ONE REGENCY PLAZA SUITE 600","PROVIDENCE","RI",2903,NA,NA,330,"ONE REGENCY PLAZA SUITE 600, PROVIDENCE, RI, 2903","No_Match",NA,NA,NA,NA
963331,"ONE RESEARCH COURT SUITE 450","ROCKVILLE","MD",20001,NA,NA,331,"ONE RESEARCH COURT SUITE 450, ROCKVILLE, MD, 20001","No_Match",NA,NA,NA,NA
963332,"ONE RESEARCH CT SUITE 450","ROCKVILLE","MD",20850,NA,NA,332,"ONE RESEARCH CT SUITE 450, ROCKVILLE, MD, 20850","No_Match",NA,NA,NA,NA
963333,"ONE RICHMOND SQUARE STE 125B","PROVIDENCE","RI",2906,NA,NA,333,"ONE RICHMOND SQUARE STE 125B, PROVIDENCE, RI, 2906","No_Match",NA,NA,NA,NA
963334,"ONE RIVER PLACE 3004","NEW YORK","NY",10036,NA,NA,334,"ONE RIVER PLACE 3004, NEW YORK, NY, 10036","No_Match",NA,NA,NA,NA
963335,"ONE RIVERFRONT PLAZA STE 410","NEWARK","NJ",7102,NA,NA,335,"ONE RIVERFRONT PLAZA STE 410, NEWARK, NJ, 7102","No_Match",NA,NA,NA,NA
963336,"ONE RIVERFRONT PLAZA","NEWARK","NJ",7102,NA,NA,336,"ONE RIVERFRONT PLAZA, NEWARK, NJ, 7102","No_Match",NA,NA,NA,NA
963337,"ONE RIVERSIDE DRIVE","EAST HARTFORD","CT",6040,NA,NA,337,"ONE RIVERSIDE DRIVE, EAST HARTFORD, CT, 6040","No_Match",NA,NA,NA,NA
963338,"ONE RIVERWAY STE 2450","HOUSTON","TX",77056,NA,NA,338,"ONE RIVERWAY STE 2450, HOUSTON, TX, 77056","No_Match",NA,NA,NA,NA
963339,"ONE RIVERWAY SUITE 700","HOUSTON","TX",77056,NA,NA,339,"ONE RIVERWAY SUITE 700, HOUSTON, TX, 77056","No_Match",NA,NA,NA,NA
963340,"ONE RIVERWAY","HOUSTON","TX",77056,NA,NA,340,"ONE RIVERWAY, HOUSTON, TX, 77056","No_Match",NA,NA,NA,NA
963341,"ONE ROSES BLUFF PARKWAY","MADISON","MS",39110,NA,NA,341,"ONE ROSES BLUFF PARKWAY, MADISON, MS, 39110","No_Match",NA,NA,NA,NA
963342,"ONE RUSSELL PLACE","DAYTON","OH",45409,NA,NA,342,"ONE RUSSELL PLACE, DAYTON, OH, 45409","No_Match",NA,NA,NA,NA
963343,"ONE S MAIN ST 8TH FLOOR","MT CLEMENS","MI",48023,NA,NA,343,"ONE S MAIN ST 8TH FLOOR, MT CLEMENS, MI, 48023","No_Match",NA,NA,NA,NA
963344,"ONE S MAIN STREET","MOUNT CLEMENS","MI",48043,NA,NA,344,"ONE S MAIN STREET, MOUNT CLEMENS, MI, 48043","No_Match",NA,NA,NA,NA
963345,"ONE SANFORD COURT","NORTH WOODMERE","NY",11581,NA,NA,345,"ONE SANFORD COURT, NORTH WOODMERE, NY, 11581","No_Match",NA,NA,NA,NA
963346,"ONE SCOTT CIRCLE NUMBER 113","WASHINGTON","DC",20036,NA,NA,346,"ONE SCOTT CIRCLE NUMBER 113, WASHINGTON, DC, 20036","No_Match",NA,NA,NA,NA
963347,"ONE SE 3RD AVE STE 2950","MIAMI","FL",33131,NA,NA,347,"ONE SE 3RD AVE STE 2950, MIAMI, FL, 33131","No_Match",NA,NA,NA,NA
963348,"ONE SE THIRD AVENUE","MIAMI","FL",33131,NA,NA,348,"ONE SE THIRD AVENUE, MIAMI, FL, 33131","No_Match",NA,NA,NA,NA
963349,"ONE SEAL HARBOR","WINTHROP","MA",2152,NA,NA,349,"ONE SEAL HARBOR, WINTHROP, MA, 2152","No_Match",NA,NA,NA,NA
963350,"ONE SHIELDS AVENUE","DAVIS","CA",95616,NA,NA,350,"ONE SHIELDS AVENUE, DAVIS, CA, 95616","No_Match",NA,NA,NA,NA
963351,"ONE SNYDER CIRCLE","NEW MILFORD","NJ",7646,NA,NA,351,"ONE SNYDER CIRCLE, NEW MILFORD, NJ, 7646","No_Match",NA,NA,NA,NA
963352,"ONE SOLUTIONS WAY","WAYNESBORO","VA",22980,NA,NA,352,"ONE SOLUTIONS WAY, WAYNESBORO, VA, 22980","No_Match",NA,NA,NA,NA
963353,"ONE SOUTH MAIN STREET SUITE 1200","SALT LAKE CITY","UT",84113,NA,NA,353,"ONE SOUTH MAIN STREET SUITE 1200, SALT LAKE CITY, UT, 84113","No_Match",NA,NA,NA,NA
963354,"ONE SOUTH MAIN STREET","MOUNT VERNON","OH",43050,NA,NA,354,"ONE SOUTH MAIN STREET, MOUNT VERNON, OH, 43050","No_Match",NA,NA,NA,NA
963355,"ONE SOUTH MAIN SUITE 1100","SALT LAKE CITY","UT",84133,NA,NA,355,"ONE SOUTH MAIN SUITE 1100, SALT LAKE CITY, UT, 84133","No_Match",NA,NA,NA,NA
963356,"ONE SOUTH ROAD","OYSTER BAY COVE","NY",11771,NA,NA,356,"ONE SOUTH ROAD, OYSTER BAY COVE, NY, 11771","No_Match",NA,NA,NA,NA
963357,"ONE SOUTH TOOLE","TUCSON","AZ",85701,NA,NA,357,"ONE SOUTH TOOLE, TUCSON, AZ, 85701","No_Match",NA,NA,NA,NA
963358,"ONE SOUTHWIRE DRIVE","CARROLLTON","GA",30117,NA,NA,358,"ONE SOUTHWIRE DRIVE, CARROLLTON, GA, 30117","No_Match",NA,NA,NA,NA
963359,"ONE STAGECOACH LN","HUNTINGTON STATION","NY",11746,NA,NA,359,"ONE STAGECOACH LN, HUNTINGTON STATION, NY, 11746","No_Match",NA,NA,NA,NA
963360,"ONE STONEGATE","HURRICANE","WV",25526,NA,NA,360,"ONE STONEGATE, HURRICANE, WV, 25526","No_Match",NA,NA,NA,NA
963361,"ONE SUNRISE MALL UNIT 1025","MASSAPEQUA","NY",11758,NA,NA,361,"ONE SUNRISE MALL UNIT 1025, MASSAPEQUA, NY, 11758","No_Match",NA,NA,NA,NA
963362,"ONE SUPREME COURT","SWAMPSCOTT","MA",1907,NA,NA,362,"ONE SUPREME COURT, SWAMPSCOTT, MA, 1907","No_Match",NA,NA,NA,NA
963363,"ONE SYLVESTER AVE","BERRIEN SPRINGS","MI",49013,NA,NA,363,"ONE SYLVESTER AVE, BERRIEN SPRINGS, MI, 49013","No_Match",NA,NA,NA,NA
963364,"ONE TAMARAC LN","CHERRY HILLS","CO",80202,NA,NA,364,"ONE TAMARAC LN, CHERRY HILLS, CO, 80202","No_Match",NA,NA,NA,NA
963365,"ONE TARA BLV ST 200","NASHUA","NH",3062,NA,NA,365,"ONE TARA BLV ST 200, NASHUA, NH, 3062","No_Match",NA,NA,NA,NA
963366,"ONE TAYLOR PLACE","PINEHURST","NC",28374,NA,NA,366,"ONE TAYLOR PLACE, PINEHURST, NC, 28374","No_Match",NA,NA,NA,NA
963367,"ONE THOMAS CIRCLE NW SUITE 700","WASHINGTON","DC",20005,NA,NA,367,"ONE THOMAS CIRCLE NW SUITE 700, WASHINGTON, DC, 20005","No_Match",NA,NA,NA,NA
963368,"ONE THRASHER STREET","TAUNTON","MA",2780,NA,NA,368,"ONE THRASHER STREET, TAUNTON, MA, 2780","No_Match",NA,NA,NA,NA
963369,"ONE TOWN CENTRE APT 501","CLIFFSIDE PARK","NJ",7010,NA,NA,369,"ONE TOWN CENTRE APT 501, CLIFFSIDE PARK, NJ, 7010","No_Match",NA,NA,NA,NA
963370,"ONE TRINITY PLACE","SAN ANTONIO","TX",78212,NA,NA,370,"ONE TRINITY PLACE, SAN ANTONIO, TX, 78212","No_Match",NA,NA,NA,NA
963371,"ONE TROPICANA DR","ST PETERSBURG","FL",33705,NA,NA,371,"ONE TROPICANA DR, ST PETERSBURG, FL, 33705","No_Match",NA,NA,NA,NA
963372,"ONE TURKS HEAD PLACE SUITE 1440","PROVIDENCE","RI",2903,NA,NA,372,"ONE TURKS HEAD PLACE SUITE 1440, PROVIDENCE, RI, 2903","No_Match",NA,NA,NA,NA
963373,"ONE TURKS HEAD PLACE SUITE 700","PROVIDENCE","RI",2903,NA,NA,373,"ONE TURKS HEAD PLACE SUITE 700, PROVIDENCE, RI, 2903","No_Match",NA,NA,NA,NA
963374,"ONE TUSCOLA STREET","SAGINAW","MI",48607,NA,NA,374,"ONE TUSCOLA STREET, SAGINAW, MI, 48607","No_Match",NA,NA,NA,NA
963375,"ONE UNIVERISTY PLAZA MS 6100","CAPE GIRARDEAU","MO",63701,NA,NA,375,"ONE UNIVERISTY PLAZA MS 6100, CAPE GIRARDEAU, MO, 63701","No_Match",NA,NA,NA,NA
963376,"ONE UNIVERSITY AVE  BOX 1513","ANGOLA","IN",46703,NA,NA,376,"ONE UNIVERSITY AVE  BOX 1513, ANGOLA, IN, 46703","No_Match",NA,NA,NA,NA
963377,"ONE UNIVERSITY AVE  BOX 435","ANGOLA","IN",46703,NA,NA,377,"ONE UNIVERSITY AVE  BOX 435, ANGOLA, IN, 46703","No_Match",NA,NA,NA,NA
963378,"ONE UNIVERSITY AVE  BOX 561","ANGOLA","IN",46703,NA,NA,378,"ONE UNIVERSITY AVE  BOX 561, ANGOLA, IN, 46703","No_Match",NA,NA,NA,NA
963379,"ONE UNIVERSITY AVE","BOURBONNAIS","IL",60914,NA,NA,379,"ONE UNIVERSITY AVE, BOURBONNAIS, IL, 60914","No_Match",NA,NA,NA,NA
963380,"ONE UNIVERSITY BLVD - ZH 217","LA GRANDE","OR",97850,NA,NA,380,"ONE UNIVERSITY BLVD - ZH 217, LA GRANDE, OR, 97850","No_Match",NA,NA,NA,NA
963381,"ONE UNIVERSITY DRIVE SC-E250","CAMARILLO","CA",90312,NA,NA,381,"ONE UNIVERSITY DRIVE SC-E250, CAMARILLO, CA, 90312","No_Match",NA,NA,NA,NA
963382,"ONE UNIVERSITY HEIGHTS","ASHEVILLE","NC",28804,NA,NA,382,"ONE UNIVERSITY HEIGHTS, ASHEVILLE, NC, 28804","No_Match",NA,NA,NA,NA
963383,"ONE UNIVERSITY HEIGHTS","ASHVILLE","NC",28804,NA,NA,383,"ONE UNIVERSITY HEIGHTS, ASHVILLE, NC, 28804","No_Match",NA,NA,NA,NA
963384,"ONE UNIVERSITY PARK DRIVE","NASHVILLE","TN",37204,NA,NA,384,"ONE UNIVERSITY PARK DRIVE, NASHVILLE, TN, 37204","No_Match",NA,NA,NA,NA
963385,"ONE UNIVERSITY PARKWAY","HIGH POINT","NC",27268,NA,NA,385,"ONE UNIVERSITY PARKWAY, HIGH POINT, NC, 27268","No_Match",NA,NA,NA,NA
963386,"ONE UNIVERSITY PARKWAY","ROMEOVILLE","IL",60446,NA,NA,386,"ONE UNIVERSITY PARKWAY, ROMEOVILLE, IL, 60446","No_Match",NA,NA,NA,NA
963387,"ONE UNIVERSITY PLACE","CHESTER","PA",19013,NA,NA,387,"ONE UNIVERSITY PLACE, CHESTER, PA, 19013","No_Match",NA,NA,NA,NA
963388,"ONE UNIVERSITY PLACE","NEW YORK","NY",10003,NA,NA,388,"ONE UNIVERSITY PLACE, NEW YORK, NY, 10003","No_Match",NA,NA,NA,NA
963389,"ONE UNIVERSITY PLACE","SHREVEPORT","LA",71115,NA,NA,389,"ONE UNIVERSITY PLACE, SHREVEPORT, LA, 71115","No_Match",NA,NA,NA,NA
963390,"ONE UNIVERSITY PLAZA MS 6100","CAPE GIRARDEAU","MO",63701,NA,NA,390,"ONE UNIVERSITY PLAZA MS 6100, CAPE GIRARDEAU, MO, 63701","No_Match",NA,NA,NA,NA
963391,"ONE UNIVERSITY PLAZA UHB 3031","SPRINGFIELD","IL",62703,NA,NA,391,"ONE UNIVERSITY PLAZA UHB 3031, SPRINGFIELD, IL, 62703","No_Match",NA,NA,NA,NA
963392,"ONE UNIVERSITY PLAZA","SPRINGFIELD","AL",36092,NA,NA,392,"ONE UNIVERSITY PLAZA, SPRINGFIELD, AL, 36092","No_Match",NA,NA,NA,NA
